{
  "_example": true,
  "schema": "sb-bundle/1",
  "kern_version": "0.1.0",
  "erstellt_utc": "2026-10-20T09:30:12.481Z",
  "host": "SRV-HV01",
  "data_dir": "C:\\Tools\\sbench\\data",
  "anonymized": false,
  "includes": [
    "sbench-gui"
  ],
  "files": [
    {
      "path": "info.json",
      "size_bytes": 4211,
      "sha256": "3f4c1a0e9b6d2e5f7a8c9d0e1f2a3b4c5d6e7f8091a2b3c4d5e6f708192a3b4c"
    },
    {
      "path": "results/20261020-081502-a1b2.json",
      "size_bytes": 182344,
      "sha256": "9e107d9d372bb6826bd81d3542a419d6e277d4d731479571562b82f74494341f"
    },
    {
      "path": "runs/20261020-081502-a1b2.jsonl",
      "size_bytes": 2817,
      "sha256": "5d1f0c6e8a4b2f7c9e3a1d6b8f0e2c4a7b9d1f3e5c7a9b0d2f4e6a8c0b1d3f5e"
    },
    {
      "path": "jobs/20261020-081502-a1b2.json",
      "size_bytes": 912,
      "sha256": "e4d909c290d0fb1ca068ffaddf22cbd0e4d909c290d0fb1ca068ffaddf22cbd0"
    },
    {
      "path": "logs/20261020-081502-a1b2.log",
      "size_bytes": 2380,
      "sha256": "d7a8fbb307d7809469ca9abcb0082e4f8d5651e46d3cdb762d02d0bf37c9e592"
    },
    {
      "path": "extra/sbench-gui/gui.log",
      "size_bytes": 4096,
      "sha256": "0a1b2c3d4e5f60718293a4b5c6d7e8f90a1b2c3d4e5f60718293a4b5c6d7e8f9"
    }
  ]
}
